{
  "schema_version": 1,
  "source": "swpc",
  "product": "swpc.alerts",
  "fetched_at": "2026-09-27T16:30:37Z",
  "source_url": "https://services.swpc.noaa.gov/products/alerts.json",
  "record": {"product_id":"EF3A","issue_datetime":"2026-09-27 05:02:04.940","message":"Space Weather Message Code: ALTEF3\r\nSerial Number: 3746\r\nIssue Time: 2026 Sep 27 0502 UTC\r\n\r\nCONTINUED ALERT: Electron 2MeV Integral Flux exceeded 1,000pfu\nContinuation of Serial Number: 3745\nBegin Time: 2026 Sep 26 1535 UTC\n\nYesterday Maximum 2MeV Flux: 1260 pfu\nMax time: 2026 Sep 26 1645 UTC"}
}
