{
  "schema_version": 1,
  "source": "swpc",
  "product": "swpc.goes.xrays",
  "fetched_at": "2026-09-27T16:30:37Z",
  "source_url": "https://services.swpc.noaa.gov/json/goes/primary/xrays-6-hour.json",
  "record": {"time_tag": "2026-09-27T10:29:00Z", "satellite": 18, "flux": 8.154792396908306e-09, "observed_flux": 4.99756787064598e-08, "electron_correction": 4.18208863095515e-08, "electron_contaminaton": true, "energy": "0.05-0.4nm"}
}
